{
  "$schema": "https://json-schema.org/draft/2020-12/schema",
  "$id": "https://politic-effects.dev/schema/vorhaben-katalog-legacy.json",
  "title": "VorhabenKatalog (Legacy)",
  "type": "object",
  "required": ["version", "zielgruppen", "fragen", "vorhaben"],
  "additionalProperties": false,
  "properties": {
    "version": {
      "type": "string",
      "pattern": "^\\d+\\.\\d+\\.\\d+$"
    },
    "zielgruppen": {
      "type": "array",
      "items": { "$ref": "zielgruppe.json" },
      "minItems": 1
    },
    "fragen": {
      "type": "array",
      "items": { "$ref": "frage-legacy.json" }
    },
    "vorhaben": {
      "type": "array",
      "items": { "$ref": "vorhaben.json" },
      "minItems": 1
    }
  }
}
